Stock,News,Sentiment
SMCI,"Here’s Why Super Micro Computer (SMCI) Declined in Q3. Columbia Acorn Fund, distributed by Columbia Management Investment Distributors, released its third-quarter 2024 investor letter. A copy of the letter can be downloaded here. In the quarter, the fund returned 9.15% while the benchmark, the Russell 2500 Growth Index, returned 6.99%. A strong market rally occurred throughout the quarter, and the Columbia Acorn Fund beat its benchmark due to positive stock selection. With recoveries for smaller caps and several cyclical stocks, the third quarter witnessed a return to animal spirits following the previous quarter’s more risk-averse environment. In addition, you can check the fund’s top 5 holdings for its best picks for 2024. Columbia Acorn Fund highlighted stocks like Super Micro Computer, Inc. (NASDAQ:SMCI), in the third quarter 2024 investor letter. Super Micro Computer, Inc. (NASDAQ:SMCI) develops and manufactures high-performance server and storage solutions. The one-month return of Super Micro Computer, Inc. (NASDAQ:SMCI) was -48.26%, and its shares lost 4.14% of their value over the last 52 weeks. On November 8, 2024, Super Micro Computer, Inc. (NASDAQ:SMCI) stock closed at $24.52 per share with a market capitalization of $14.358 billion. Columbia Acorn Fund stated the following regarding Super Micro Computer, Inc. (NASDAQ:SMCI) in its Q3 2024 investor letter:. ""Super Micro Computer, Inc. (NASDAQ:SMCI) had a tough quarter due to a confluence of negative events. It declined, but is still up significantly for the year. While demand for the company’s AI server racks remains strong, with revenue up over 100%, gross margins have fallen sharply for two straight quarters, implying a price war. In addition, Super Micro was the subject of a short-seller report and a delay in filing its annual report with the SEC. We have been taking profits in the stock all year and have only a small position, which we are maintaining given the strong performance and demand for Super Micro’s AI racks and a depressed stock valuation."". A team of technicians in a server room, testing and managing the newest server solutions. Super Micro Computer, Inc. (NASDAQ:SMCI) is not on our list of 31 Most Popular Stocks Among Hedge Funds. As per our database, 47 hedge fund portfolios held Super Micro Computer, Inc. (NASDAQ:SMCI) at the end of the second quarter which was 35 in the previous quarter. While we acknowledge the potential of Super Micro Computer, Inc. (NASDAQ:SMCI) as an investment, our conviction lies in the belief that AI stocks hold greater promise for delivering higher returns, and doing so within a shorter timeframe. If you are looking for an AI stock that is as promising as NVIDIA but that trades at less than 5 times its earnings, check out our report about the cheapest AI stock. In another article, we discussed Super Micro Computer, Inc. (NASDAQ:SMCI) and shared AI news and ratings investors should not miss. In addition, please check out our hedge fund investor letters Q3 2024 page for more investor letters from hedge funds and other leading investors. READ NEXT: Michael Burry Is Selling These Stocks and A New Dawn Is Coming to US Stocks. Disclosure: None. This article is originally published at Insider Monkey. Sign in to access your portfolio.",Neutral
MNDY,"monday.com's $1 Billion ARR Triumph Overshadowed by 20% Stock Plunge--What's Spooking Investors? monday.com (NASDAQ:MNDY) just reported what should've been a celebratory quarter. The SaaS powerhouse posted non-GAAP EPS of $0.85, crushing estimates by $0.22, with revenue jumping 33% year-over-year to $251 million, a solid $4.72 million beat. The company's net dollar retention rate hit 111%, while its second-largest customera global tech giantmore than doubled its seats to 60,000. Co-founders Roy Mann and Eran Zinman called crossing $1 billion in annual recurring revenue (ARR) a major milestone and hinted that this is just the start of an even bigger growth story. Warning! GuruFocus has detected 3 Warning Sign with MNDY. But here's where things get tricky: despite the blowout numbers, monday.com's stock tanked nearly 20%. Why? The company issued Q4 guidance of $260$262 million, representing 2829% growthsolid, but not the rocket-fueled momentum investors had hoped for. The selloff overshadowed some impressive Q3 metrics: non-GAAP operating income climbed to $32.2 million, free cash flow hit $82.4 million, and high-value customer accounts (over $100,000 in ARR) surged 44%. Leadership changes added another layer of intrigue, with seasoned growth strategist Adi Dar stepping in as COO while CRO Yoni Osherov, who helped scale ARR from $10 million to $1 billion, announced his departure. The selloff feels more like a reaction to sky-high expectations than a verdict on monday.com's future. The company remains on track to end 2024 with nearly $1 billion in revenue and a stellar 30% free cash flow margin. Investors may be jittery, but the long-term potential is hard to ignore. With its growing foothold in enterprise markets and a proven ability to scale, monday.com is far from a typical SaaS playerit's positioning itself as the go-to platform for redefining how businesses collaborate. This article first appeared on GuruFocus. Sign in to access your portfolio.",Neutral
MNDY,"Monday.com Stock Tanks Despite Q3 Beat, Raised Outlook. Monday.com Ltd (NASDAQ:MNDY) reported fiscal third-quarter 2024 revenue growth of 33% Y/Y to $251.0 million, beating the analyst consensus estimate of $246.1 million. The project management software company's adjusted EPS of $0.85 beat the analyst consensus estimate of $0.63, but the stock price plunged after the results. Also Read: AMC Networks Q3 Earnings: Streaming Subscriber Growth Shines Amid Ad Revenue Dip Bolstered By Netflix, Amazon Partnerships. The net dollar retention rate was 111%, and it was 114% for customers with more than ten users. The number of paid customers with over $50,000 in annual recurring revenue (ARR) rose 40% year over year to 2,907. The adjusted operating margin was firm year-on-year at 13%. In the quarter, Monday.com generated an operating cash flow of $86.6 million, with $82.4 million of free cash flow, compared to $66.6 million and $64.9 million, respectively, a year ago. MNDY held $1.4 billion in cash and equivalents as of September. Monday.com's co-founders and co-CEOs, Roy Mann and Eran Zinman, attributed the strong third-quarter performance to effective execution and ongoing enhancements to the platform, emphasizing their excitement for future growth after surpassing $1 billion in Annual Recurring Revenue (ARR). CFO Eliran Glazer highlighted solid revenue growth, improved profitability, and better retention trends, especially as the company expands its focus on larger customers. He expressed confidence in sustaining this momentum through the end of the year and into fiscal 2025, aiming for continued scalable growth. Outlook: Monday.com expects fourth-quarter revenue of $260 million—$262 million (versus the consensus of $246.1 million) and an adjusted operating margin of 11%–12%. Monday.com raised 2024 revenue guidance to $964 million–$966 million (prior $956 million–$961 million) against the consensus of $960.2 million and an adjusted operating margin of 12%–13% (prior 10%—11%). Last week, Wells Fargo analyst Michael Berg maintained Monday.Com with an Overweight rating and raised the price target from $315 to $330. Monday.Com stock gained over 82% year-to-date. Price Action: MNDY stock is down 13.10% at $282.00 premarket at the last check Monday. Also Read:. Paramount Q3: Streaming Gains, Operating Income Declines. Up Next: Transform your trading with Benzinga Edge's one-of-a-kind market trade ideas and tools. Click now to access unique insights that can set you ahead in today's competitive market. Get the latest stock analysis from Benzinga? This article Monday.com Stock Tanks Despite Q3 Beat, Raised Outlook originally appeared on Benzinga.com. © 2024 Benzinga.com. Benzinga does not provide investment advice. All rights reserved. Sign in to access your portfolio.",Neutral
MNDY,"Monday.com dives despite annual guidance hike, Q3 beat. Investing.com -- Monday (NASDAQ:MNDY).com lifted its annual revenue and operating profit guidance but its shares slumped more than 12% in premarket trading Monday. For the Q3 of fiscal 2024, the cloud team management software maker reported earnings per share (EPS) of $0.85, topping consensus estimates of $0.63. The company generated a revenue of $251 million for the period, also beating the $246.17 million estimated by analysts. Looking ahead, Monday.com expects fourth-quarter 2024 revenue between $260 million and $262 million, aligning closely with the market consensus of $261 million. It also projects an adjusted operating profit for the quarter in the range of $29 million to $31 million. “Monday.com had a strong Q3, driven by the team’s consistent execution as we focus on deepening our product capabilities and bolstering the platform to support customers of all sizes,” said Monday.com co-founders and co-CEOs, Roy Mann and Eran Zinman. “Reaching $1 billion in ARR marks a major milestone in our journey as a company, and we are more excited than ever to enter this next stage of growth, building on the strong foundation we’ve established.”. For the full year, monday.com raised its revenue guidance to a range of $964 million to $966 million, up from a previous forecast of $956 million to $961 million and ahead of the consensus estimate of $960.2 million at the midpoint. Moreover, the company now expects adjusted operating profit of $121 million to $123 million, significantly higher than its earlier projection of $100 million to $105 million. Related Articles. Monday.com dives despite annual guidance hike, Q3 beat. Cigna says it is not pursuing combination with Humana. Futures extend gains as post-election rally continues. Sign in to access your portfolio.",Neutral
MNDY,"Monday.com (NASDAQ:MNDY) Posts Better-Than-Expected Sales In Q3 But Stock Drops 13.1%. Project management software maker Monday.com (NASDAQ:MNDY) reported Q3 CY2024 results exceeding the market’s revenue expectations , with sales up 32.7% year on year to $251 million. The company expects next quarter’s revenue to be around $261 million, close to analysts’ estimates. Its non-GAAP profit of $0.85 per share was also 34.6% above analysts’ consensus estimates. Is now the time to buy Monday.com? Find out in our full research report. Revenue: $251 million vs analyst estimates of $246.3 million (1.9% beat). Adjusted EPS: $0.85 vs analyst estimates of $0.63 (34.6% beat). Adjusted Operating Income: $32.18 million vs analyst estimates of $22.49 million (43.1% beat). Revenue Guidance for Q4 CY2024 is $261 million at the midpoint, roughly in line with what analysts were expecting. Adj. Operating Income Guidance for Q4 CY2024 is $30 million at the midpoint, above analyst estimates. Gross Margin (GAAP): 89.7%, up from 88.5% in the same quarter last year. Operating Margin: -10.9%, down from -1.3% in the same quarter last year. Free Cash Flow Margin: 32.8%, up from 21.5% in the previous quarter. Customers: 2,907 customers paying more than $50,000 annually. Market Capitalization: $16.17 billion. “We are very pleased with our results in Q3, with solid revenue growth and profitability, as well as improving retention trends as we continue to expand to larger customers,” said Eliran Glazer, monday.com CFO. Founded in Israel in 2014, and named after the dreaded first day of the work week, Monday.com (NASDAQ:MNDY) makes software as a service platform that helps teams plan and track work efficiently. The future of work requires teams to collaborate across departments and remote offices. Project management software is both driving this change and benefiting from it. While the trend of collaborative work management has been strong for a while, the Covid pandemic has definitively accelerated the demand for tools that allow work to be done remotely. A company’s long-term performance can give signals about its business quality. Even a bad business can shine for one or two quarters, but a top-tier one grows for years. Thankfully, Monday.com’s 51.1% annualized revenue growth over the last three years was incredible. Its growth surpassed the average software company and shows its offerings resonate with customers, a great starting point for our analysis. This quarter, Monday.com reported wonderful year-on-year revenue growth of 32.7%, and its $251 million of revenue exceeded Wall Street’s estimates by 1.9%. Company management is currently guiding for a 28.8% year-on-year increase next quarter. Looking further ahead, sell-side analysts expect revenue to grow 26.7% over the next 12 months, a deceleration versus the last three years. This projection is still noteworthy and implies the market is baking in success for its products and services. When a company has more cash than it knows what to do with, buying back its own shares can make a lot of sense–as long as the price is right. Luckily, we’ve found one, a low-priced stock that is gushing free cash flow AND buying back shares. Click here to claim your Special Free Report on a fallen angel growth story that is already recovering from a setback. We enjoyed seeing Monday.com beat on revenue and adjusted operating income. Guidance for next quarter's revenue was just in line, and the market seems to be punishing the company for not guiding above. The stock traded down 13.1% to $282 immediately following the results. So should you invest in Monday.com right now? When making that decision, it’s important to consider its valuation, business qualities, as well as what has happened in the latest quarter. We cover that in our actionable full research report which you can read here, it’s free. Sign in to access your portfolio.",Neutral
ABBV,"AbbVie's Emraclidine For Schizophrenia 'Surprisingly Disappoints,' Analyst Says Pipeline Is Underappreciated. On Monday, AbbVie Inc (NYSE:ABBV) stock plunged after two trials investigating emraclidine as a once-daily, oral monotherapy treatment for adults with schizophrenia failed two Phase 2 trials. The studies did not meet their primary endpoint of showing a statistically significant improvement in the change from baseline in the Positive and Negative Syndrome Scale (PANSS) total score compared to the placebo group at week 6. PANSS is a scale used for measuring the symptom severity of schizophrenia. Also Read: Bristol-Myers Squibb Leads Biopharma Recovery With Almost 25% Growth In Market Cap, But Novo Nordisk And Lilly Suffer Market Setbacks. Cantor Fitzgerald points out that Wall Street had anticipated positive results from both of AbbVie’s studies, though they expected the details to be mixed, such as how impressive the PANSS score might be. Even with the negative results, Cantor Fitzgerald remains positive on AbbVie’s stock and believes the company's pipeline is undervalued. “This is disappointing and unexpected,” the analyst added. The disappointing AbbVie’s trial results is a benefit for Bristol Myers Squibb & Co’s (NYSE:BMY) approved schizophrenia drug, Cobenfy, but they raise questions about using selective muscarinic targeting for treating schizophrenia and other conditions. The data could suggest differences between positive allosteric modulators like emraclidine and direct agonists like Cobenfy. Cantor maintains the Overweight rating with a price target of $240. Despite this setback, the Cerevel acquisition still holds promise, with other treatments like Darigabat (for epilepsy and anxiety) and Tavapadon (Parkinson’s) continuing to progress. Top-line results from the TEMPO-2 Phase 3 flexible-dose monotherapy trial of Tavapadon in Parkinson’s Disease are expected by the end of 2024. Results from the long-term safety study, TEMPO-4, are expected in 2025. Price Action: ABBV stock is down 11.7% at $176.16 at last check Monday. Photo: Formatoriginal/Shutterstock.com. Read Next:. Taiwan Semiconductor Stock Drops as US Orders Halt on AI Chip Sales to China. Date. Firm. Action. From. To. Feb 2022. UBS. Downgrades. Buy. Neutral. Feb 2022. Mizuho. Maintains. Buy. Feb 2022. Barclays. Maintains. Equal-Weight. View More Analyst Ratings for ABBV. View the Latest Analyst Ratings. Up Next: Transform your trading with Benzinga Edge's one-of-a-kind market trade ideas and tools. Click now to access unique insights that can set you ahead in today's competitive market. Get the latest stock analysis from Benzinga? This article AbbVie's Emraclidine For Schizophrenia 'Surprisingly Disappoints,' Analyst Says Pipeline Is Underappreciated originally appeared on Benzinga.com. © 2024 Benzinga.com. Benzinga does not provide investment advice. All rights reserved. Sign in to access your portfolio.",Neutral
LB,"LandBridge Schedules Third Quarter 2024 Earnings Release and Conference Call. HOUSTON, October 09, 2024--(BUSINESS WIRE)--LandBridge Company LLC (""LandBridge"") today announced that it will release its financial results for the third quarter 2024 after market close on Wednesday, November 6, 2024. LandBridge will host a webcast and conference call to discuss its results on Thursday, November 7, 2024, at 8:00 a.m. Central Time / 9:00 a.m. Eastern Time. Webcast Instructions:. To listen to the live webcast, please visit the Investor Relations section of LandBridge’s website, https://ir.landbridgeco.com/overview/default.aspx. The webcast will be archived on the site for those unable to listen in real-time. Conference Call Instructions:. To access the live conference call, participants should call (800) 715-9871 (or (646) 307-1963 for international participants) and provide the Conference ID 4907698. Call participants should dial-in approximately 10 minutes early so that their information can be collected prior to the start of the conference. An audio replay will be available following the conclusion of the call and remain available through November 21, 2024. The replay can be accessed by dialing (800) 770-2030 and providing the Conference ID 4907698. About LandBridge. LandBridge owns approximately 220,000 surface acres across Texas and New Mexico, located primarily in the heart of the Delaware sub-basin in the Permian Basin, the most active region for oil and natural gas exploration and development in the United States. LandBridge actively manages its land and resources to support and encourage oil and natural gas production and broader industrial development. Since its founding in 2021, LandBridge has served as one of the leading land management businesses within the Delaware Basin. LandBridge was formed by Five Point Energy LLC, a leading energy private equity firm with a successful track record of investing in and developing energy, environmental water management and sustainable infrastructure companies within the Permian Basin. View source version on businesswire.com: https://www.businesswire.com/news/home/20241009293089/en/. Contacts. Media Contact Daniel Yunger / Nathaniel ShahanKekst CNCkekst-landbridge@kekstcnc.com Investor Contact Scott McNeelyChief Financial OfficerLandBridge Company LLC832-703-1433Contact@LandBridgeCo.com. Sign in to access your portfolio.",Neutral
MRNA,"Moderna (MRNA) Q3 Earnings: How Key Metrics Compare to Wall Street Estimates. Moderna (MRNA) reported $1.86 billion in revenue for the quarter ended September 2024, representing a year-over-year increase of 1.7%. EPS of $0.03 for the same period compares to -$1.39 a year ago. The reported revenue represents a surprise of +47.73% over the Zacks Consensus Estimate of $1.26 billion. With the consensus EPS estimate being -$1.89, the EPS surprise was +101.59%. While investors closely watch year-over-year changes in headline numbers -- revenue and earnings -- and how they compare to Wall Street expectations to determine their next course of action, some key metrics always provide a better insight into a company's underlying performance. Since these metrics play a crucial role in driving the top- and bottom-line numbers, comparing them with the year-ago numbers and what analysts estimated about them helps investors better project a stock's price performance. Here is how Moderna performed in the just reported quarter in terms of the metrics most widely monitored and projected by Wall Street analysts:. Product sales- Rest of world: $324 million compared to the $362.69 million average estimate based on two analysts. The reported number represents a change of -56.3% year over year. Product sales- United States: $1.22 billion versus the two-analyst average estimate of $728.42 million. The reported number represents a year-over-year change of +33.1%. Revenue- Net Product sales: $1.82 billion versus the eight-analyst average estimate of $1.22 billion. The reported number represents a year-over-year change of +3.6%. Revenue- Other revenue: $42 million versus $16.30 million estimated by five analysts on average. Compared to the year-ago quarter, this number represents a -43.2% change. Revenue- Other revenue- Grant revenue: $7 million versus $8.75 million estimated by two analysts on average. View all Key Company Metrics for Moderna here>>>Shares of Moderna have returned -11.5% over the past month versus the Zacks S&P 500 composite's +4.9% change. The stock currently has a Zacks Rank #3 (Hold), indicating that it could perform in line with the broader market in the near term. Want the latest recommendations from Zacks Investment Research? Today, you can download 7 Best Stocks for the Next 30 Days. Click to get this free report. Moderna, Inc. (MRNA) : Free Stock Analysis Report. To read this article on Zacks.com click here. Zacks Investment Research. Sign in to access your portfolio.",Neutral
VKTX,"Viking stock fluctuates amid manufacturing concerns with obesity pill. Shares in Viking Therapeutics jumped after the company shared positive data from an early-stage trial of its obesity pill but then dipped after an analyst shared concerns about manufacturing difficulties with the drug. The Phase I study (NCT05203237), evaluating VK2735, reported a placebo-adjusted weight loss of 6.8% in the high-dose cohort after four weeks in 92 patients. The company announced the positive data for the dual glucagon-like peptide-1 receptor (GLP-1R)/gastric inhibitory polypeptide (GIP) receptor agonist at ObesityWeek 2024, taking place in Texas, US, from 3 to 6 November. The trial investigated eight doses of the drug, ranging from 2.5mg to 100mg versus a placebo. The majority of adverse events were mild or moderate, with four patients on Viking’s drug and two on placebo discontinuing the trial. Viking Therapeutics said it will begin a 13-week Phase II study of its oral candidate in Q4 2024. The company’s shares rose by 7.44%, from a close of $72.88 on 1 November to an open of $78.30 on 4 November after the company shared the positive data. It then fell by 19.36% before market close after Deutsche Bank analyst James Shin said it could be “costly with capital requirements and expertise” beyond major competitors, reports Reuters. Last month, Viking CEO Brian Lian claimed the company is in conversations with manufacturers to ensure a “blockbuster” supply. Viking also revealed more data from its Phase II study of a subcutaneous version of VK2735. The 13-week VENTURE study (NCT06068946) showed a mean weight loss of 14.7% or 13.1% adjusted for placebo, in the high dose cohort. The company announced mid-stage data from the VENTURE study in February 2024 which sent the company’s stock price soaring by 80%. The mid-stage data showed average weight losses of 9.2kg, 10.7kg, 13.3kg, 14.6kg, and 1.8kg in the 2.5mg, 5mg, 10mg, 15mg, and placebo groups, respectively. The company was previously considering a Phase IIb trial but after sharing such positive data, it will be progressing straight to a Phase III trial after receiving the green light from the US Food and Drug Administration (FDA). According to GlobalData, both oral and subcutaneous versions of VK2735 could become a direct competitor to Eli Lilly’s Mounjaro (tirzepatide), the only dual GLP-1/GIP receptor agonist currently approved. GlobalData is the parent company of the Clinical Trials Arena. The weight loss field is heavily dominated by glucagon-like peptide 1 receptor agonists (GLP-1ra's), with Eli Lilly’s drug and Novo Nordisk’s semaglutide being the front runners. Semaglutide, marketed at Ozempic for type 2 diabetes (T2D) and Wegovy for obesity is predicted to raise $42.85bn in sales in 2030, according to GlobalData. Meanwhile, Eli Lilly’s candidate, marketed as Mounjaro for T2D and Zepbound for obesity, is predicted to bring in £57.65bn in the same year. ""Viking stock fluctuates amid manufacturing concerns with obesity pill"" was originally created and published by Clinical Trials Arena, a GlobalData owned brand. The information on this site has been included in good faith for general informational purposes only. It is not intended to amount to advice on which you should rely, and we give no representation, warranty or guarantee, whether express or implied as to its accuracy or completeness. You must obtain professional or specialist advice before taking, or refraining from, any action on the basis of the content on our site. Sign in to access your portfolio.",Neutral
